id,img_url,name,gender,category,type,abilities,weakness,height,weight,attack,defense,hp,special_attack,special_defense,speed,version_x,version_y
249,https://www.pokemon.com/static-assets/content-assets/cms2/img/pokedex/full/249.png,Lugia,unknown,Diving,"Psychic, Flying",Pressure,"Electric, Ice, Rock, Ghost, Dark",520.7,214.29,6,8,7,6,10,7,"Lugia’s wings pack devastating power—a light fluttering of its wings can blow apart regular houses. As a result, this Pokémon chooses to live out of sight deep under the sea.","Lugia’s wings pack devastating power—a light fluttering of its wings can blow apart regular houses. As a result, this Pokémon chooses to live out of sight deep under the sea."
250,https://www.pokemon.com/static-assets/content-assets/cms2/img/pokedex/full/250.png,Ho-Oh,unknown,Rainbow,"Fire, Flying",Pressure,"Water, Electric, Rock,",381.0,197.41,8,6,7,7,10,6,Ho-Oh’s feathers glow in seven colors depending on the angle at which they are struck by light. These feathers are said to bring happiness to the bearers. This Pokémon is said to live at the foot of a rainbow.,Ho-Oh’s feathers glow in seven colors depending on the angle at which they are struck by light. These feathers are said to bring happiness to the bearers. This Pokémon is said to live at the foot of a rainbow.
251,https://www.pokemon.com/static-assets/content-assets/cms2/img/pokedex/full/251.png,Celebi,unknown,Time Travel,"Psychic, Grass",Natural Cure,"Fire, Ice, Poison, Flying, Bug, , Ghost, Dark",60.96,4.95,6,6,6,6,6,6,"This Pokémon came from the future by crossing over time. It is thought that so long as Celebi appears, a bright and shining future awaits us.","This Pokémon came from the future by crossing over time. It is thought that so long as Celebi appears, a bright and shining future awaits us."
252,https://www.pokemon.com/static-assets/content-assets/cms2/img/pokedex/full/252.png,Treecko,"male, female",Wood Gecko,Grass,Overgrow,"Fire, Ice, Poison, Flying, Bug",50.8,4.95,3,3,3,4,4,5,"The small hooks on the soles of its feet latch on to walls and ceilings, so it will never fall even while hanging upside down.",Treecko can quickly scale even vertical surfaces. It senses humidity with its tail to predict the next day’s weather.
253,https://www.pokemon.com/static-assets/content-assets/cms2/img/pokedex/full/253.png,Grovyle,"male, female",Wood Gecko,Grass,Overgrow,"Fire, Ice, Poison, Flying, Bug",88.9,21.42,4,3,3,5,4,6,Its strongly developed thigh muscles give it astounding agility and jumping performance.,"Grovyle leaps from branch to branch in large trees, moving with ease. It propels itself with astounding speed and force."
254,https://www.pokemon.com/static-assets/content-assets/cms2/img/pokedex/full/254.png,Sceptile,"male, female",Forest,Grass,Overgrow,"Fire, Ice, Poison, Flying, Bug",170.18,51.8,5,4,5,7,5,8,It agilely flits through the jungle and uses the sharp-edged leaves on its arms to cut down its prey.,The leaves on its arms are as sharp as swords. It agilely leaps about the branches of trees to strike its enemies.
255,https://www.pokemon.com/static-assets/content-assets/cms2/img/pokedex/full/255.png,Torchic,"male, female",Chick,Fire,Blaze,"Water, Ground, Rock",40.64,2.48,4,3,3,5,3,3,"Torchic feels toasty warm if you hug it. It has a flame sac inside its belly, and the flames burn continuously as long as Torchic has life in it.","In its belly, it has a sac filled with burning fire, meaning that Torchic feels as warm as a hot-water bottle if you hug it."
256,https://www.pokemon.com/static-assets/content-assets/cms2/img/pokedex/full/256.png,Combusken,"male, female",Young Fowl,"Fire, Fighting",Blaze,"Water, Ground, Flying, Psychic",88.9,19.35,5,4,4,5,4,4,It boosts its concentration by emitting harsh cries. Its kicks have outstanding destructive power.,"When it enters battle, the flame inside its body burns stronger. Its kicks have outstanding destructive power."
257,https://www.pokemon.com/static-assets/content-assets/cms2/img/pokedex/full/257.png,Blaziken,"male, female",Blaze,"Fire, Fighting",Blaze,"Water, Ground, Flying, Psychic",190.5,51.57,8,5,5,7,5,5,"When facing a tough foe, it looses flames from its wrists. Its powerful legs let it jump clear over buildings.","It can jump powerfully, clearing a 30-story building in a single leap. Its flaming punches scorch its opponents."
258,https://www.pokemon.com/static-assets/content-assets/cms2/img/pokedex/full/258.png,Mudkip,"male, female",Mud Fish,Water,Torrent,"Grass, Electric",40.64,7.56,5,3,3,3,3,3,"It has the power to crush large boulders into pieces. To rest, it buries itself in mud at the bottom of a river.","When it uses its large tail fin, it picks up speed rapidly in the water. It is strong in spite of its small size."
259,https://www.pokemon.com/static-assets/content-assets/cms2/img/pokedex/full/259.png,Marshtomp,"male, female",Mud Fish,"Water, Ground",Torrent,"Grass,",71.12,27.77,5,5,5,4,5,3,Living on muddy ground that provides poor footing has served to train its lower body and caused it to develop sturdy legs.,It is at its best when on muddy ground that offers poor footing. It quickly overwhelms opponents that are bogged down and unable to move.
260,https://www.pokemon.com/static-assets/content-assets/cms2/img/pokedex/full/260.png,Swampert,"male, female",Mud Fish,"Water, Ground",Torrent,"Grass,",149.86,81.27,7,6,6,5,6,4,"Its arms are hard as rock. With one swing, it can break an enormous boulder into pieces.","Swampert’s arms are rock-hard. With one swing, they can batter down Swampert’s foes. This Pokémon makes its nest on beautiful beaches."
261,https://www.pokemon.com/static-assets/content-assets/cms2/img/pokedex/full/261.png,Poochyena,"male, female",Bite,Dark,"Run Away, Quick Feet","Fighting, Bug, Fairy",50.8,13.5,4,3,3,2,2,3,"It bares its large fangs and barks vigorously to try to intimidate opponents, but this is actually a manifestation of its cowardly nature.","Poochyena pursue their prey in packs. Once the prey is exhausted, the pack finishes it off. But sometimes the prey retaliates, and the pack flees."
262,https://www.pokemon.com/static-assets/content-assets/cms2/img/pokedex/full/262.png,Mightyena,"male, female",Bite,Dark,"Intimidate, Quick Feet","Fighting, Bug, Fairy",99.06,36.72,6,5,5,4,4,5,They faithfully follow the orders of their leader. Prey targeted by Mightyena is never allowed to escape the outstanding teamwork of its pursuers.,"Once it’s caught the scent of faraway prey, the leader gives a signal, and the whole pack moves out."
263,https://www.pokemon.com/static-assets/content-assets/cms2/img/pokedex/full/263.png,Zigzagoon,"male, female",Tiny Raccoon,Normal,"Pickup, Gluttony",Fighting,40.64,17.37,2,3,3,2,3,4,It walks in zigzag fashion. It’s good at finding items in the grass and even in the ground.,It walks in zigzag fashion. It’s good at finding items in the grass and even in the ground.
264,https://www.pokemon.com/static-assets/content-assets/cms2/img/pokedex/full/264.png,Linoone,"male, female",Rushing,Normal,"Pickup, Gluttony",Fighting,50.8,32.27,5,4,5,3,4,6,"It charges prey at speeds over 60 mph. However, because it can only run straight, it often fails.","It charges prey at speeds over 60 mph. However, because it can only run straight, it often fails."
265,https://www.pokemon.com/static-assets/content-assets/cms2/img/pokedex/full/265.png,Wurmple,"male, female",Worm,Bug,Shield Dust,"Fire, Flying, Rock",30.48,3.56,3,3,3,2,2,2,"Using the spikes on its rear end, Wurmple peels the bark off trees and feeds on the sap that oozes out. This Pokémon’s feet are tipped with suction pads that allow it to cling to glass without slipping.",Wurmple is targeted by Swellow as prey. This Pokémon will try to resist by pointing the spikes on its rear at the attacking predator. It will weaken the foe by leaking poison from the spikes.
266,https://www.pokemon.com/static-assets/content-assets/cms2/img/pokedex/full/266.png,Silcoon,"male, female",Cocoon,Bug,Shed Skin,"Fire, Flying, Rock",60.96,9.9,3,4,3,2,2,1,"Silcoon tethers itself to a tree branch using silk to keep from falling. There, this Pokémon hangs quietly while it awaits evolution. It peers out of the silk cocoon through a small hole.","Silcoon was thought to endure hunger and not consume anything before its evolution. However, it is now thought that this Pokémon slakes its thirst by drinking rainwater that collects on its silk."
267,https://www.pokemon.com/static-assets/content-assets/cms2/img/pokedex/full/267.png,Beautifly,"male, female",Butterfly,"Bug, Flying",Swarm,"Fire, Electric, Ice, Flying, Rock,",99.06,28.17,5,3,4,6,3,4,"Beautifly’s favorite food is the sweet pollen of flowers. If you want to see this Pokémon, just leave a potted flower by an open window. Beautifly is sure to come looking for pollen.","Beautifly has a long mouth like a coiled needle, which is very convenient for collecting pollen from flowers. This Pokémon rides the spring winds as it flits around gathering pollen."
268,https://www.pokemon.com/static-assets/content-assets/cms2/img/pokedex/full/268.png,Cascoon,"male, female",Cocoon,Bug,Shed Skin,"Fire, Flying, Rock",71.12,11.43,3,4,3,2,2,1,"Cascoon makes its protective cocoon by wrapping its body entirely with a fine silk from its mouth. Once the silk goes around its body, it hardens. This Pokémon prepares for its evolution inside the cocoon.","If it is attacked, Cascoon remains motionless however badly it may be hurt. It does so because if it were to move, its body would be weak upon evolution. This Pokémon will also not forget the pain it endured."
269,https://www.pokemon.com/static-assets/content-assets/cms2/img/pokedex/full/269.png,Dustox,"male, female",Poison Moth,"Bug, Poison",Shield Dust,"Fire, Flying, Psychic, Rock",119.38,31.36,3,5,4,3,6,4,"Dustox is instinctively drawn to light. Swarms of this Pokémon are attracted by the bright lights of cities, where they wreak havoc by stripping the leaves off roadside trees for food.","When Dustox flaps its wings, a fine dust is scattered all over. This dust is actually a powerful poison that will even make a pro wrestler sick. This Pokémon searches for food using its antennae like radar."
270,https://www.pokemon.com/static-assets/content-assets/cms2/img/pokedex/full/270.png,Lotad,"male, female",Water Weed,"Water, Grass","Swift Swim, Rain Dish","Poison, Flying, Bug",50.8,2.56,2,2,3,3,3,2,The leaf on its head is naturally dirt repellent and will stay clean even after transporting Pokémon that are covered in mud.,Lotad will gather in lakes that have good water quality. The surfaces of these lakes sometimes become covered in Lotad leaves.
271,https://www.pokemon.com/static-assets/content-assets/cms2/img/pokedex/full/271.png,Lombre,"male, female",Jolly,"Water, Grass","Swift Swim, Rain Dish","Poison, Flying, Bug",119.38,32.27,3,3,4,4,5,3,Old folklore in Kitakami tells of a mischievous child who was reborn as a Pokémon.,It prefers waterfronts with plentiful food. It became nocturnal so it wouldn’t have to compete for food with bird Pokémon.
272,https://www.pokemon.com/static-assets/content-assets/cms2/img/pokedex/full/272.png,Ludicolo,"male, female",Carefree,"Water, Grass","Swift Swim, Rain Dish","Poison, Flying, Bug",149.86,54.59,5,5,5,6,6,5,There are structures throughout its whole body that produce energy when hit by sound waves with a cheerful rhythm.,"Dancing with an upbeat rhythm energizes and emboldens it, letting it face any foe without fear."
273,https://www.pokemon.com/static-assets/content-assets/cms2/img/pokedex/full/273.png,Seedot,"male, female",Acorn,Grass,"Chlorophyll, Early Bird","Fire, Ice, Poison, Flying, Bug",50.8,3.96,3,3,3,2,2,2,"To expand its habitat, it pretends to be a nut so that bird Pokémon will pick it up and carry it far away.","Seedot live in trees, hanging from the branches and leeching moisture. Rows of them can be found dangling from large, young trees."
274,https://www.pokemon.com/static-assets/content-assets/cms2/img/pokedex/full/274.png,Nuzleaf,"male, female",Wily,"Grass, Dark","Chlorophyll, Early Bird","Fire, Ice, Fighting, Poison, Flying, Bug, , Fairy",99.06,27.77,5,3,5,4,3,4,"It leads a quiet life deep in the forest. If anything wanders into its territory, Nuzleaf will warn the intruder by sounding its grass flute.","Its sensory functions are concentrated in its pointed nose, which it uses to sense its surroundings. The nose is also its weak point."
275,https://www.pokemon.com/static-assets/content-assets/cms2/img/pokedex/full/275.png,Shiftry,"male, female",Wicked,"Grass, Dark","Chlorophyll, Early Bird","Fire, Ice, Fighting, Poison, Flying, Bug, , Fairy",129.54,59.13,6,4,6,6,4,5,"It is said that when Shiftry flaps its leafy fans atop ancient trees, chilly winds blow and the season rolls into winter.",Legends tell of a bird Pokémon that received divine punishment for its evil deeds and had its beak and wings replaced.
276,https://www.pokemon.com/static-assets/content-assets/cms2/img/pokedex/full/276.png,Taillow,"male, female",Tiny Swallow,"Normal, Flying",Guts,"Electric, Ice, Rock",30.48,2.29,4,2,3,2,2,5,"Taillow courageously stands its ground against foes, however strong they may be. This gutsy Pokémon will remain defiant even after a loss. On the other hand, it cries loudly if it becomes hungry.","Taillow is young—it has only just left its nest. As a result, it sometimes becomes lonesome and cries at night. This Pokémon feeds on Wurmple that live in forests."
277,https://www.pokemon.com/static-assets/content-assets/cms2/img/pokedex/full/277.png,Swellow,"male, female",Swallow,"Normal, Flying",Guts,"Electric, Ice, Rock",71.12,19.67,5,4,4,5,3,8,"Swellow flies high above our heads, making graceful arcs in the sky. This Pokémon dives at a steep angle as soon as it spots its prey. The hapless prey is tightly grasped by Swellow’s clawed feet, preventing escape.","Swellow is very conscientious about the upkeep of its glossy wings. Once two Swellow are gathered, they diligently take care of cleaning each other’s wings."
278,https://www.pokemon.com/static-assets/content-assets/cms2/img/pokedex/full/278.png,Wingull,"male, female",Seagull,"Water, Flying","Keen Eye, Hydration","Electric, , Rock",60.96,9.4,2,2,3,4,2,5,"It soars high in the sky, riding on updrafts like a glider. It carries food tucked in its bill.","It rides upon ocean winds as if it were a glider. In the winter, it hides food around its nest."
279,https://www.pokemon.com/static-assets/content-assets/cms2/img/pokedex/full/279.png,Pelipper,"male, female",Water Bird,"Water, Flying","Keen Eye, Drizzle","Electric, , Rock",119.38,27.77,3,6,4,6,5,4,It is a flying transporter that carries small Pokémon in its beak. It bobs on the waves to rest its wings.,"It protects its young in its beak. It bobs on waves, resting on them on days when the waters are calm."
280,https://www.pokemon.com/static-assets/content-assets/cms2/img/pokedex/full/280.png,Ralts,"male, female",Feeling,"Psychic, Fairy","Synchronize, Trace","Poison, Ghost, Steel",40.64,6.57,2,2,2,3,3,3,The horns on its head provide a strong power that enables it to sense people’s emotions.,It is highly attuned to the emotions of people and Pokémon. It hides if it senses hostility.
281,https://www.pokemon.com/static-assets/content-assets/cms2/img/pokedex/full/281.png,Kirlia,"male, female",Emotion,"Psychic, Fairy","Synchronize, Trace","Poison, Ghost, Steel",78.74,20.02,3,3,3,4,4,3,It has a psychic power that enables it to distort the space around it and see into the future.,The cheerful spirit of its Trainer gives it energy for its psychokinetic power. It spins and dances when happy.
282,https://www.pokemon.com/static-assets/content-assets/cms2/img/pokedex/full/282.png,Gardevoir,"male, female",Embrace,"Psychic, Fairy","Synchronize, Trace","Poison, Ghost, Steel",160.02,48.02,4,4,4,8,7,5,"To protect its Trainer, it will expend all its psychic power to create a small black hole.",It unleashes psychokinetic energy at full power when protecting a Trainer it has bonded closely with.
283,https://www.pokemon.com/static-assets/content-assets/cms2/img/pokedex/full/283.png,Surskit,"male, female",Pond Skater,"Bug, Water",Swift Swim,"Electric, Flying, Rock",50.8,1.67,2,2,3,3,4,4,"They usually live on ponds, but after an evening shower, they may appear on puddles in towns.","It secretes a thick, sweet-scented syrup from the tip of its head. It lives on weed-choked ponds."
284,https://www.pokemon.com/static-assets/content-assets/cms2/img/pokedex/full/284.png,Masquerain,"male, female",Eyeball,"Bug, Flying",Intimidate,"Fire, Electric, Ice, Flying, Rock,",78.74,3.56,4,4,5,6,5,5,It flaps its four wings to hover and fly freely in any direction—to and fro and sideways.,"The antennae have distinctive patterns that look like eyes. When it rains, they grow heavy, making flight impossible."
285,https://www.pokemon.com/static-assets/content-assets/cms2/img/pokedex/full/285.png,Shroomish,"male, female",Mushroom,Grass,"Effect Spore, Poison Heal","Fire, Ice, Poison, Flying, Bug",40.64,4.46,3,4,4,3,4,3,It prefers damp places. By day it remains still in the forest shade. It releases toxic powder from its head.,"If it senses danger, it scatters spores from the top of its head to protect itself."
286,https://www.pokemon.com/static-assets/content-assets/cms2/img/pokedex/full/286.png,Breloom,"male, female",Mushroom,"Grass, Fighting","Effect Spore, Poison Heal","Fire, Ice, Poison, Flying, , Psychic, Fairy",119.38,38.88,8,5,4,4,4,5,It scatters poisonous spores and throws powerful punches while its foe is hampered by inhaled spores.,"The seeds on its tail are made of toxic spores. It knocks out foes with quick, virtually invisible punches."
287,https://www.pokemon.com/static-assets/content-assets/cms2/img/pokedex/full/287.png,Slakoth,"male, female",Slacker,Normal,Truant,Fighting,78.74,23.8,4,4,4,3,3,2,It sleeps for 20 hours every day. Making drowsy those that see it is one of its abilities.,The way Slakoth lolls around makes anyone who watches it feel like doing the same.
288,https://www.pokemon.com/static-assets/content-assets/cms2/img/pokedex/full/288.png,Vigoroth,"male, female",Wild Monkey,Normal,Vital Spirit,Fighting,139.7,46.12,5,5,5,4,4,6,Its stress level rises if it cannot keep moving constantly. Too much stress makes it feel sick.,"It is always hungry because it won’t stop rampaging. Even while it is eating, it can’t keep still."
289,https://www.pokemon.com/static-assets/content-assets/cms2/img/pokedex/full/289.png,Slaking,"male, female",Lazy,Normal,Truant,Fighting,200.66,129.47,10,6,9,6,4,6,"It is the world’s most slothful Pokémon. However, it can exert horrifying power by releasing pent-up energy all at once.",This Pokémon lives lying on its side. It only rolls over and moves when there is no more grass to eat.
290,https://www.pokemon.com/static-assets/content-assets/cms2/img/pokedex/full/290.png,Nincada,"male, female",Trainee,"Bug, Ground",Compound Eyes,"Fire, Water, Ice, Flying",50.8,5.45,3,6,2,2,2,3,"Because it lived almost entirely underground, it is nearly blind. It uses its antennae instead.",It can sometimes live underground for more than 10 years. It absorbs nutrients from the roots of trees.
291,https://www.pokemon.com/static-assets/content-assets/cms2/img/pokedex/full/291.png,Ninjask,"male, female",Ninja,"Bug, Flying",Speed Boost,"Fire, Electric, Ice, Flying, Rock,",78.74,11.93,6,3,4,3,3,10,Its cry leaves a lasting headache if heard for too long. It moves so quickly that it is almost invisible.,"This Pokémon is so quick, it is said to be able to avoid any attack. It loves to feed on tree sap."
292,https://www.pokemon.com/static-assets/content-assets/cms2/img/pokedex/full/292.png,Shedinja,unknown,Shed,"Bug, Ghost",Wonder Guard,"Fire, Flying, Rock, Ghost, Dark",78.74,1.17,6,3,1,2,2,3,A most peculiar Pokémon that somehow appears in a Poké Ball when a Nincada evolves.,"A strange Pokémon—it flies without moving its wings, has a hollow shell for a body, and does not breathe."
293,https://www.pokemon.com/static-assets/content-assets/cms2/img/pokedex/full/293.png,Whismur,"male, female",Whisper,Normal,Soundproof,Fighting,60.96,16.16,3,2,4,3,2,2,"The cry of a Whismur is over 100 decibels. If you’re close to a Whismur when it lets out a cry, you’ll be stuck with an all-day headache.","When Whismur cries, the sound of its own voice startles it, making the Pokémon cry even louder. It cries until it’s exhausted, then it falls asleep."
294,https://www.pokemon.com/static-assets/content-assets/cms2/img/pokedex/full/294.png,Loudred,"male, female",Big Voice,Normal,Soundproof,Fighting,99.06,40.19,5,3,5,5,3,3,"Loudred’s ears serve as speakers, and they can put out sound waves powerful enough to blow away a house.",The force of this Pokémon’s loud voice isn’t just the sound—it’s also the wave of air pressure that blows opponents away and damages them.
295,https://www.pokemon.com/static-assets/content-assets/cms2/img/pokedex/full/295.png,Exploud,"male, female",Loud Noise,Normal,Soundproof,Fighting,149.86,83.34,6,4,7,6,5,4,"In the past, people would use the loud voices of these Pokémon as a means of communication between distant cities.","This Pokémon can do more than just shout. To communicate with others of its kind, it’ll emit all sorts of sounds from the holes in its body."
296,https://www.pokemon.com/static-assets/content-assets/cms2/img/pokedex/full/296.png,Makuhita,"male, female",Guts,Fighting,"Guts, Thick Fat","Flying, Psychic, Fairy",99.06,85.73,4,2,5,2,2,2,It grows stronger by enduring harsh training. It is a gutsy Pokémon that can withstand any attack.,It toughens up by slamming into thick trees over and over. It gains a sturdy body and dauntless spirit.
297,https://www.pokemon.com/static-assets/content-assets/cms2/img/pokedex/full/297.png,Hariyama,"male, female",Arm Thrust,Fighting,"Guts, Thick Fat","Flying, Psychic, Fairy",231.14,251.78,8,4,9,3,4,3,It loves challenging others to tests of strength. It has the power to stop a train with a slap.,It stomps on the ground to build power. It can send a 10-ton truck flying with a straight-arm punch.
298,https://www.pokemon.com/static-assets/content-assets/cms2/img/pokedex/full/298.png,Azurill,"male, female",Polka Dot,"Normal, Fairy","Thick Fat, Huge Power","Poison, Steel",20.32,1.98,2,3,3,2,3,2,Its tail bounces like a rubber ball. It flings that tail around to fight opponents bigger than itself.,Its tail is packed full of the nutrients it needs to grow.
299,https://www.pokemon.com/static-assets/content-assets/cms2/img/pokedex/full/299.png,Nosepass,"male, female",Compass,Rock,"Sturdy, Magnet Pull","Water, Grass, Fighting, Ground, Steel",99.06,96.21,3,8,2,3,6,2,"The magnet in Nosepass’s nose provides an unerring compass, making this Pokémon an excellent partner for Trainers going on a journey.","When endangered, it may protect itself by increasing its magnetism and drawing nearby iron objects to its body."
300,https://www.pokemon.com/static-assets/content-assets/cms2/img/pokedex/full/300.png,Skitty,"male, female",Kitten,Normal,"Cute Charm, Normalize",Fighting,60.96,10.94,3,3,3,3,3,3,Skitty has the habit of becoming fascinated by moving objects and chasing them around. This Pokémon is known to chase after its own tail and become dizzy.,"Skitty is known to chase around playfully after its own tail. In the wild, this Pokémon lives in holes in the trees of forests. It is very popular as a pet because of its adorable looks."
301,https://www.pokemon.com/static-assets/content-assets/cms2/img/pokedex/full/301.png,Delcatty,"male, female",Prim,Normal,"Cute Charm, Normalize",Fighting,109.22,32.36,4,4,5,4,4,6,"Delcatty prefers to live an unfettered existence in which it can do as it pleases at its own pace. Because this Pokémon eats and sleeps whenever it decides, its daily routines are completely random.","Delcatty sleeps anywhere it wants without keeping a permanent nest. If other Pokémon approach it as it sleeps, this Pokémon will never fight—it will just move away somewhere else."
302,https://www.pokemon.com/static-assets/content-assets/cms2/img/pokedex/full/302.png,Sableye,"male, female",Darkness,"Dark, Ghost","Keen Eye, Stall",Fairy,50.8,10.94,5,5,3,4,4,3,It dwells in the darkness of caves. It uses its sharp claws to dig up gems to nourish itself.,Materials from gems it has eaten float to the surface of its body and can form an infinite number of patterns among individuals.
303,https://www.pokemon.com/static-assets/content-assets/cms2/img/pokedex/full/303.png,Mawile,"male, female",Deceiver,"Steel, Fairy","Intimidate, Hyper Cutter","Fire, Ground",60.96,11.43,5,5,3,4,4,3,"It uses its docile-looking face to lull foes into complacency, then bites with its huge, relentless jaws.",It chomps with its gaping mouth. Its huge jaws are actually steel horns that have been transformed.
304,https://www.pokemon.com/static-assets/content-assets/cms2/img/pokedex/full/304.png,Aron,"male, female",Iron Armor,"Steel, Rock","Rock Head, Sturdy","Water, Fighting, , Ground,",40.64,59.53,5,6,3,3,3,2,It eats iron ore—and sometimes railroad tracks— to build up the steel armor that protects its body.,"When Aron evolves, its steel armor peels off. In ancient times, people would collect Aron’s shed armor and make good use of it in their daily lives."
305,https://www.pokemon.com/static-assets/content-assets/cms2/img/pokedex/full/305.png,Lairon,"male, female",Iron Armor,"Steel, Rock","Rock Head, Sturdy","Water, Fighting, , Ground,",88.9,119.07,6,9,4,3,3,3,"Lairon live in mountains brimming with spring water and iron ore, so these Pokémon often came into conflict with humans in the past.","During territorial disputes, Lairon fight by slamming into each other. Close inspection of their steel armor reveals scratches and dents."
