id,img_url,name,gender,category,type,abilities,weakness,height,weight,attack,defense,hp,special_attack,special_defense,speed,version_x,version_y
782,https://www.pokemon.com/static-assets/content-assets/cms2/img/pokedex/full/782.png,Jangmo-o,"male, female",Scaly,Dragon,"Soundproof, Bulletproof","Ice, Dragon, Fairy",60.96,29.48,4,4,3,3,3,3,"The scale atop its head is useful for both offense and defense. It bravely stands and faces its foes rather than turning tail, even if its foes are strong.",They communicate with their allies using the sounds their scales make when struck. A group of these Pokémon causes quite a racket.
783,https://www.pokemon.com/static-assets/content-assets/cms2/img/pokedex/full/783.png,Hakamo-o,"male, female",Scaly,"Dragon, Fighting","Soundproof, Bulletproof","Ice, Flying, Psychic, Dragon, Fairy,",119.38,46.62,5,6,4,4,5,4,It gets into fistfights so intense that the scales on its arms peel off. Bare arms are a sign of valiance.,It fires itself up by striking its scales with force as it dances. Its roar is a battle cry.
784,https://www.pokemon.com/static-assets/content-assets/cms2/img/pokedex/full/784.png,Kommo-o,"male, female",Scaly,"Dragon, Fighting","Soundproof, Bulletproof","Ice, Flying, Psychic, Dragon, Fairy,",160.02,77.58,7,8,5,6,7,5,"It lets its arm hang, and then—quick as a flash—swings upward to land its specialty punch and send the opponent flying high into the sky.",It bashes its scales to test its opponents’ mettle. The sound of struck Kommo-o scales frightens weaker foes and sends them running.
785,https://www.pokemon.com/static-assets/content-assets/cms2/img/pokedex/full/785.png,Tapu Koko,unknown,Land Spirit,"Electric, Fairy",Electric Surge,"Poison, Ground",180.34,20.34,7,5,5,6,5,8,"Although it’s called a guardian deity, if a person or Pokémon puts it in a bad mood, it will become a malevolent deity and attack.","The lightning-wielding guardian deity of Melemele, Tapu Koko is brimming with curiosity and appears before people from time to time."
786,https://www.pokemon.com/static-assets/content-assets/cms2/img/pokedex/full/786.png,Tapu Lele,unknown,Land Spirit,"Psychic, Fairy",Psychic Surge,"Poison, Ghost, Steel",119.38,18.45,5,5,5,8,7,6,It heals the wounds of people and Pokémon by sprinkling them with its sparkling scales. This guardian deity is worshiped on Akala.,"Although called a guardian deity, Tapu Lele is devoid of guilt about its cruel disposition and can be described as nature incarnate."
787,https://www.pokemon.com/static-assets/content-assets/cms2/img/pokedex/full/787.png,Tapu Bulu,unknown,Land Spirit,"Grass, Fairy",Grassy Surge,"Fire, Ice, Poison, , Flying, Steel",190.5,45.13,8,7,5,5,6,5,"Although it’s called a guardian deity, it’s violent enough to crush anyone it sees as an enemy.","It makes ringing sounds with its tail to let others know where it is, avoiding unneeded conflicts. This guardian deity of Ula’ula controls plants."
788,https://www.pokemon.com/static-assets/content-assets/cms2/img/pokedex/full/788.png,Tapu Fini,unknown,Land Spirit,"Water, Fairy",Misty Surge,"Grass, Electric, Poison",129.54,21.02,5,7,5,6,8,5,"This guardian deity of Poni Island manipulates water. Because it lives deep within a thick fog, it came to be both feared and revered.","Although it’s called a guardian deity, terrible calamities sometimes befall those who recklessly approach Tapu Fini."
789,https://www.pokemon.com/static-assets/content-assets/cms2/img/pokedex/full/789.png,Cosmog,unknown,Nebula,Psychic,Unaware,"Bug, Ghost, Dark",20.32,0.09,2,2,3,2,2,3,"Even though its helpless, gaseous body can be blown away by the slightest breeze, it doesn’t seem to care.","Whether or not it’s a Pokémon from this world is a mystery. When it’s in a jam, it warps away to a safe place to hide."
790,https://www.pokemon.com/static-assets/content-assets/cms2/img/pokedex/full/790.png,Cosmoem,unknown,Protostar,Psychic,Sturdy,"Bug, Ghost, Dark",10.16,991.98,2,8,3,2,8,3,The king who ruled Alola in times of antiquity called it the “cocoon of the stars” and built an altar to worship it.,"As it absorbs light, Cosmoem continues to grow. Its golden shell is surprisingly solid."
791,https://www.pokemon.com/static-assets/content-assets/cms2/img/pokedex/full/791.png,Solgaleo,unknown,Sunne,"Psychic, Steel",Full Metal Body,"Fire, Ground, Ghost, Dark",340.36,228.19,9,7,9,7,6,6,Sometimes the result of its opening an Ultra Wormhole is that energy and life-forms from other worlds are called here to this world.,"In writings from the distant past, it’s called by the name “the beast that devours the sun.”"
792,https://www.pokemon.com/static-assets/content-assets/cms2/img/pokedex/full/792.png,Lunala,unknown,Moone,"Psychic, Ghost",Shadow Shield,"Ghost, , Dark,",398.78,119.07,7,6,9,9,7,6,"Records of it exist in writings from long, long ago, where it was known by the name “the beast that calls the moon.”",It sometimes summons unknown powers and life-forms here to this world from holes that lead to other worlds.
793,https://www.pokemon.com/static-assets/content-assets/cms2/img/pokedex/full/793.png,Nihilego,unknown,Parasite,"Rock, Poison",Beast Boost,"Water, Ground, , Psychic, Steel",119.38,55.08,4,3,7,8,8,7,"A life-form from another world, it was dubbed a UB and is thought to produce a strong neurotoxin.",It appeared in this world from an Ultra Wormhole. Nihilego appears to be a parasite that lives by feeding on people and Pokémon.
794,https://www.pokemon.com/static-assets/content-assets/cms2/img/pokedex/full/794.png,Buzzwole,unknown,Swollen,"Bug, Fighting",Beast Boost,"Fire, Flying, , Psychic, Fairy",238.76,330.98,9,9,7,4,4,5,"Although it’s alien to this world and a danger here, it’s apparently a common organism in the world where it normally lives.",Buzzwole goes around showing off its abnormally swollen muscles. It is one kind of Ultra Beast.
795,https://www.pokemon.com/static-assets/content-assets/cms2/img/pokedex/full/795.png,Pheromosa,unknown,Lissome,"Bug, Fighting",Beast Boost,"Fire, Flying, , Psychic, Fairy",180.34,24.8,9,3,5,9,3,9,"A life-form that lives in another world, its body is thin and supple, but it also possesses great power.","Although it’s alien to this world and a danger here, it’s apparently a common organism in the world where it normally lives."
796,https://www.pokemon.com/static-assets/content-assets/cms2/img/pokedex/full/796.png,Xurkitree,unknown,Glowing,Electric,Beast Boost,Ground,381.0,99.22,6,5,5,11,5,5,"Although it’s alien to this world and a danger here, it’s apparently a common organism in the world where it normally lives.","They’ve been dubbed Ultra Beasts. Some of them stand unmoving, like trees, with their arms and legs stuck into the ground."
797,https://www.pokemon.com/static-assets/content-assets/cms2/img/pokedex/full/797.png,Celesteela,unknown,Launch,"Steel, Flying",Beast Boost,"Fire, Electric",919.48,991.98,6,7,6,7,6,4,"One of the dangerous UBs, high energy readings can be detected coming from both of its huge arms.","Although it’s alien to this world and a danger here, it’s apparently a common organism in the world where it normally lives."
798,https://www.pokemon.com/static-assets/content-assets/cms2/img/pokedex/full/798.png,Kartana,unknown,Drawn Sword,"Grass, Steel",Beast Boost,"Fire, , Fighting",30.48,0.09,11,8,4,4,2,7,"This Ultra Beast’s body, which is as thin as paper, is like a sharpened sword.","Although it’s alien to this world and a danger here, it’s apparently a common organism in the world where it normally lives."
799,https://www.pokemon.com/static-assets/content-assets/cms2/img/pokedex/full/799.png,Guzzlord,unknown,Junkivore,"Dark, Dragon",Beast Boost,"Ice, Fighting, Bug, Dragon, Fairy,",551.18,880.97,6,4,14,6,4,3,"Although it’s alien to this world and a danger here, it’s apparently a common organism in the world where it normally lives.",An unknown life-form called a UB. It may be constantly hungry—it is certainly always devouring something.
800,https://www.pokemon.com/static-assets/content-assets/cms2/img/pokedex/full/800.png,Necrozma,unknown,Prism,Psychic,Prism Armor,"Bug, Ghost, Dark",238.76,228.19,7,6,6,8,6,5,"It looks somehow pained as it rages around in search of light, which serves as its energy. It’s apparently from another world.","Light is the source of its energy. If it isn’t devouring light, impurities build up in it and on it, and Necrozma darkens and stops moving."
801,https://www.pokemon.com/static-assets/content-assets/cms2/img/pokedex/full/801.png,Magearna,unknown,Artificial,"Steel, Fairy",Soul-Heart,"Fire, Ground",99.06,79.88,6,7,5,8,7,4,It synchronizes its consciousness with others to understand their feelings. This faculty makes it useful for taking care of people.,"Built roughly 500 years ago by a scientist, the part called the Soul-Heart is the actual life-form."
802,https://www.pokemon.com/static-assets/content-assets/cms2/img/pokedex/full/802.png,Marshadow,unknown,Gloomdweller,"Fighting, Ghost",Technician,"Flying, Psychic, Ghost, Fairy",71.12,22.0,8,5,6,6,6,8,"It slips into the shadows of others and mimics their powers and movements. As it improves, it becomes stronger than those it’s imitating.","It sinks into the shadows of people and Pokémon, where it can understand their feelings and copy their capabilities."
803,https://www.pokemon.com/static-assets/content-assets/cms2/img/pokedex/full/803.png,Poipole,unknown,Poison Pin,Poison,Beast Boost,"Ground, Psychic",60.96,1.8,5,4,4,5,4,5,This Ultra Beast is well enough liked to be chosen as a first partner in its own world.,"An Ultra Beast that lives in a different world, it cackles wildly as it sprays its opponents with poison from the needles on its head."
804,https://www.pokemon.com/static-assets/content-assets/cms2/img/pokedex/full/804.png,Naganadel,unknown,Poison Pin,"Poison, Dragon",Beast Boost,"Ice, Ground, Psychic, Dragon",360.68,148.81,5,5,5,8,5,8,It stores hundreds of liters of poisonous liquid inside its body. It is one of the organisms known as UBs.,"One kind of Ultra Beast, it fires a glowing, venomous liquid from its needles. This liquid is also immensely adhesive."
805,https://www.pokemon.com/static-assets/content-assets/cms2/img/pokedex/full/805.png,Stakataka,unknown,Rampart,"Rock, Steel",Beast Boost,"Water, Fighting, , Ground,",551.18,813.51,8,13,4,4,6,1,It appeared from an Ultra Wormhole. Each one appears to be made up of many life-forms stacked one on top of each other.,"When stone walls started moving and attacking, the brute’s true identity was this mysterious life-form, which brings to mind an Ultra Beast."
806,https://www.pokemon.com/static-assets/content-assets/cms2/img/pokedex/full/806.png,Blacephalon,unknown,Fireworks,"Fire, Ghost",Beast Boost,"Water, Ground, Rock, Ghost, Dark",180.34,12.91,8,4,4,9,5,7,"It slithers toward people. Then, without warning, it triggers the explosion of its own head. It’s apparently one kind of Ultra Beast.","A UB that appeared from an Ultra Wormhole, it causes explosions, then takes advantage of opponents’ surprise to rob them of their vitality."
807,https://www.pokemon.com/static-assets/content-assets/cms2/img/pokedex/full/807.png,Zeraora,unknown,Thunderclap,Electric,Volt Absorb,Ground,149.86,44.15,7,5,6,6,5,9,"It electrifies its claws and tears its opponents apart with them. Even if they dodge its attack, they’ll be electrocuted by the flying sparks.","It approaches its enemies at the speed of lightning, then tears them limb from limb with its sharp claws."
808,https://www.pokemon.com/static-assets/content-assets/cms2/img/pokedex/full/808.png,Meltan,unknown,Hex Nut,Steel,Magnet Pull,"Fire, Fighting, Ground",20.32,7.92,4,4,3,4,3,2,"It melts particles of iron and other metals found in the subsoil, so it can absorb them into its body of molten steel.","It melts particles of iron and other metals found in the subsoil, so it can absorb them into its body of molten steel."
809,https://www.pokemon.com/static-assets/content-assets/cms2/img/pokedex/full/809.png,Melmetal,unknown,Hex Nut,Steel,Iron Fist,"Fire, Fighting, Ground",248.92,793.67,9,9,8,5,4,2,"At the end of its life-span, Melmetal will rust and fall apart. The small shards left behind will eventually be reborn as Meltan.",Centrifugal force is behind the punches of Melmetal’s heavy hex-nut arms. Melmetal is said to deliver the strongest punches of all Pokémon.
810,https://www.pokemon.com/static-assets/content-assets/cms2/img/pokedex/full/810.png,Grookey,"male, female",Chimp,Grass,Overgrow,"Fire, Ice, Poison, Flying, Bug",30.48,4.95,4,3,3,3,3,4,The stick Grookey holds has grown harder and more flexible after soaking in the energy that emanates from inside Grookey’s body.,"As Grookey strikes everything in sight with its stick, it has more and more fun, and its rhythm becomes livelier."
811,https://www.pokemon.com/static-assets/content-assets/cms2/img/pokedex/full/811.png,Thwackey,"male, female",Beat,Grass,Overgrow,"Fire, Ice, Poison, Flying, Bug",71.12,13.9,5,5,5,4,4,5,It skillfully uses its two sticks not only for drumming out rapid beats but also for pummeling opponents during battle.,It becomes intensely focused while it drums out vigorous beats—so much so that sometimes it won’t listen to its Trainer’s commands.
812,https://www.pokemon.com/static-assets/content-assets/cms2/img/pokedex/full/812.png,Rillaboom,"male, female",Drummer,Grass,Overgrow,"Fire, Ice, Poison, Flying, Bug",210.82,89.28,8,6,6,4,5,5,"Though it has a calm disposition, it won’t tolerate those who drum up discord. It strictly disciplines offenders until they learn their lesson.","When one Rillaboom challenges another who leads a troop, a drumming battle commences. The victor becomes the troop’s new boss."
813,https://www.pokemon.com/static-assets/content-assets/cms2/img/pokedex/full/813.png,Scorbunny,"male, female",Rabbit,Fire,Blaze,"Water, Ground, Rock",30.48,4.46,5,3,3,3,3,5,"Once its body has heated up, Scorbunny can use the full extent of its power. That’s why it does warm-up exercises.","Fire energy gathers in the pads of its feet, raising their temperature. Once hot, Scorbunny’s footpads can deal heavy damage to opponents."
814,https://www.pokemon.com/static-assets/content-assets/cms2/img/pokedex/full/814.png,Raboot,"male, female",Rabbit,Fire,Blaze,"Water, Ground, Rock",60.96,8.91,6,4,4,4,4,6,"Thanks to its soft and fluffy fur, Raboot can easily heat up its fire energy and produce flames with more power.","While it prides itself on its varied kicking moves, it can also deliver powerful headbutts once its flames have heated up its forehead."
815,https://www.pokemon.com/static-assets/content-assets/cms2/img/pokedex/full/815.png,Cinderace,"male, female",Striker,Fire,Blaze,"Water, Ground, Rock",139.7,32.76,7,5,5,4,5,7,"Although Cinderace loses its cool easily, it will battle flawlessly for a Trainer it trusts.","Using a ball that it made out of flames, Cinderace blinds its opponents and keeps them at bay."
816,https://www.pokemon.com/static-assets/content-assets/cms2/img/pokedex/full/816.png,Sobble,"male, female",Water Lizard,Water,Torrent,"Grass, Electric",30.48,3.96,3,3,3,5,3,5,It gets berries to eat by shooting them down with bullets of water it spurts from its mouth. Its aim is perfect.,"It’s a very cautious Pokémon. When it has no choice but to battle, it hides itself before attacking."
817,https://www.pokemon.com/static-assets/content-assets/cms2/img/pokedex/full/817.png,Drizzile,"male, female",Water Lizard,Water,Torrent,"Grass, Electric",71.12,11.43,4,4,4,6,4,6,"It extends its long, slimy tongue at blinding speeds and finishes off its prey with great skill.","Highly intelligent but also very lazy, it defends its home by laying traps."
818,https://www.pokemon.com/static-assets/content-assets/cms2/img/pokedex/full/818.png,Inteleon,"male, female",Secret Agent,Water,Torrent,"Grass, Electric",190.5,44.82,5,4,5,8,4,8,It uses special lenses in its eyes to sense things about its opponents—like their body heat—then attacks once it identifies a weak spot.,"It may present itself as being well-mannered, but deep down, it still has a lazy side. It will slack off when its Trainer isn’t looking."
819,https://www.pokemon.com/static-assets/content-assets/cms2/img/pokedex/full/819.png,Skwovet,"male, female",Cheeky,Normal,Cheek Pouch,Fighting,30.48,2.48,4,4,5,3,3,2,"It stores berries in its cheeks. When there are no berries to be found, Skwovet will stuff pebbles into its cheeks to stave off its cravings.","No matter how much it stuffs its belly with food, it is always anxious about getting hungry again. So, it stashes berries in its cheeks and tail."
820,https://www.pokemon.com/static-assets/content-assets/cms2/img/pokedex/full/820.png,Greedent,"male, female",Greedy,Normal,Cheek Pouch,Fighting,60.96,5.94,6,6,8,4,5,2,"If it spots a berry tree, it will immediately go to gather berries without a sideways glance—even if it’s in the middle of a battle.","This Pokémon makes off with heaps of fallen berries by wrapping them in its tail, which is roughly twice the length of its body."
821,https://www.pokemon.com/static-assets/content-assets/cms2/img/pokedex/full/821.png,Rookidee,"male, female",Tiny Bird,Flying,"Keen Eye, Unnerve","Electric, Ice, Rock",20.32,1.8,3,3,3,2,3,4,This Pokémon is brave and reckless. The white markings around a Rookidee’s eyes intimidate fainthearted Pokémon.,"The females are fussier than the males. If another creature dirties a female Rookidee’s wings, it’ll peck the offender relentlessly in a burning rage."
822,https://www.pokemon.com/static-assets/content-assets/cms2/img/pokedex/full/822.png,Corvisquire,"male, female",Raven,Flying,"Keen Eye, Unnerve","Electric, Ice, Rock",78.74,15.88,4,4,4,3,4,5,It’s said that the reason behind Corvisquire’s high level of intelligence is the large size of its brain relative to those of other bird Pokémon.,This intelligent Pokémon will quickly learn how to use any tool it can hold in its beak or its talons.
823,https://www.pokemon.com/static-assets/content-assets/cms2/img/pokedex/full/823.png,Corviknight,"male, female",Raven,"Flying, Steel","Pressure, Unnerve","Fire, Electric",220.98,74.39,6,7,6,4,5,4,"Corviknight can’t serve as a taxi service in Paldea because the Pokémon’s natural predators will attack it while it flies, endangering the customer.","Although its wings have partly turned to steel and become heavy as a result, this Pokémon flies through the skies with ease."
824,https://www.pokemon.com/static-assets/content-assets/cms2/img/pokedex/full/824.png,Blipbug,"male, female",Larva,Bug,"Compound Eyes, Swarm","Fire, Flying, Rock",40.64,7.92,2,2,2,2,3,3,"A constant collector of information, this Pokémon is very smart. Very strong is what it isn’t.","Often found in gardens, this Pokémon has hairs on its body that it uses to assess its surroundings."
825,https://www.pokemon.com/static-assets/content-assets/cms2/img/pokedex/full/825.png,Dottler,"male, female",Radome,"Bug, Psychic","Compound Eyes, Swarm","Fire, Flying, Bug, Rock, Ghost, Dark",40.64,19.35,3,5,3,3,6,2,"It barely moves, but it’s still alive. Hiding in its shell without food or water seems to have awakened its psychic powers.","As it grows inside its shell, it uses its psychic abilities to monitor the outside world and prepare for evolution."
826,https://www.pokemon.com/static-assets/content-assets/cms2/img/pokedex/full/826.png,Orbeetle,"male, female",Seven Spot,"Bug, Psychic","Swarm, Frisk","Fire, Flying, Bug, Rock, Ghost, Dark",40.64,40.46,3,7,4,5,8,6,"It’s famous for its high level of intelligence, and the large size of its brain is proof that it also possesses immense psychic power.",It emits psychic energy to observe and study what’s around it—and what’s around it can include things over six miles away.
827,https://www.pokemon.com/static-assets/content-assets/cms2/img/pokedex/full/827.png,Nickit,"male, female",Fox,Dark,"Run Away, Unburden","Fighting, Bug, Fairy",60.96,8.82,2,2,3,3,4,3,"Aided by the soft pads on its feet, it silently raids the food stores of other Pokémon. It survives off its ill-gotten gains.","Cunning and cautious, this Pokémon survives by stealing food from others. It erases its tracks with swipes of its tail as it makes off with its plunder."
828,https://www.pokemon.com/static-assets/content-assets/cms2/img/pokedex/full/828.png,Thievul,"male, female",Fox,Dark,"Run Away, Unburden","Fighting, Bug, Fairy",119.38,19.75,4,4,5,6,6,6,"It secretly marks potential targets with a scent. By following the scent, it stalks its targets and steals from them when they least expect it.","With a lithe body and sharp claws, it goes around stealing food and eggs. Boltund is its natural enemy."
829,https://www.pokemon.com/static-assets/content-assets/cms2/img/pokedex/full/829.png,Gossifleur,"male, female",Flowering,Grass,"Regenerator, Cotton Down","Fire, Ice, Poison, Flying, Bug",40.64,2.21,3,4,3,3,4,1,"It anchors itself in the ground with its single leg, then basks in the sun. After absorbing enough sunlight, its petals spread as it blooms brilliantly.",It whirls around in the wind while singing a joyous song. This delightful display has charmed many into raising this Pokémon.
830,https://www.pokemon.com/static-assets/content-assets/cms2/img/pokedex/full/830.png,Eldegoss,"male, female",Cotton Bloom,Grass,"Regenerator, Cotton Down","Fire, Ice, Poison, Flying, Bug",50.8,2.48,3,6,4,5,8,4,The seeds attached to its cotton fluff are full of nutrients. It spreads them on the wind so that plants and other Pokémon can benefit from them.,"The cotton on the head of this Pokémon can be spun into a glossy, gorgeous yarn—a Galar regional specialty."
831,https://www.pokemon.com/static-assets/content-assets/cms2/img/pokedex/full/831.png,Wooloo,"male, female",Sheep,Normal,"Run Away, Fluffy",Fighting,60.96,5.94,3,4,3,3,3,3,"Its curly fleece is such an effective cushion that this Pokémon could fall off a cliff and stand right back up at the bottom, unharmed.","If its fleece grows too long, Wooloo won’t be able to move. Cloth made with the wool of this Pokémon is surprisingly strong."
832,https://www.pokemon.com/static-assets/content-assets/cms2/img/pokedex/full/832.png,Dubwool,"male, female",Sheep,Normal,"Steadfast, Fluffy",Fighting,129.54,42.66,5,6,5,4,6,6,"Weave a carpet from its springy wool, and you end up with something closer to a trampoline. You’ll start to bounce the moment you set foot on it.",Its majestic horns are meant only to impress the opposite gender. They never see use in battle.
833,https://www.pokemon.com/static-assets/content-assets/cms2/img/pokedex/full/833.png,Chewtle,"male, female",Snapping,Water,"Shell Armor, Strong Jaw","Grass, Electric",30.48,8.41,4,3,3,3,3,3,"Its large front tooth is still growing in. When the tooth itches, this Pokémon will bite another Chewtle’s horn, and the two Pokémon will tussle.",A popular game among children is to lift up sticks that Chewtle have bitten onto to see whose Chewtle can hang on the longest.
834,https://www.pokemon.com/static-assets/content-assets/cms2/img/pokedex/full/834.png,Drednaw,"male, female",Bite,"Water, Rock","Shell Armor, Strong Jaw","Grass, , Electric, Fighting, Ground",99.06,114.57,7,6,6,3,4,5,"Its massive, jagged teeth can crush a boulder in a single bite. This Pokémon has an extremely vicious disposition.","Drednaw lurks along the shoreline. When prey come to drink water, Drednaw stretches its neck out and chomps down on them."
835,https://www.pokemon.com/static-assets/content-assets/cms2/img/pokedex/full/835.png,Yamper,"male, female",Puppy,Electric,Ball Fetch,Ground,30.48,13.41,3,3,4,3,3,2,"This Pokémon is very popular as a herding dog in the Galar region. As it runs, it generates electricity from the base of its tail.","This gluttonous Pokémon only assists people with their work because it wants treats. As it runs, it crackles with electricity."
836,https://www.pokemon.com/static-assets/content-assets/cms2/img/pokedex/full/836.png,Boltund,"male, female",Dog,Electric,Strong Jaw,Ground,99.06,33.75,6,4,5,6,4,8,This Pokémon generates electricity and channels it into its legs to keep them going strong. Boltund can run nonstop for three full days.,"It sends electricity through its legs to boost their strength. Running at top speed, it easily breaks 50 mph."
837,https://www.pokemon.com/static-assets/content-assets/cms2/img/pokedex/full/837.png,Rolycoly,"male, female",Coal,Rock,"Heatproof, Steam Engine","Water, Grass, Fighting, Ground, Steel",30.48,11.93,3,3,2,3,3,2,"On sunny days, Rolycoly will come out onto grassy plains and roll around. Then it will eat the grass that gets tangled in its wheel-like leg.",Chunks of the surface of this Pokémon’s body that have grown old and flaked off have long been used for fuel as an alternative to coal.
838,https://www.pokemon.com/static-assets/content-assets/cms2/img/pokedex/full/838.png,Carkol,"male, female",Coal,"Rock, Fire","Flame Body, Steam Engine","Water, , Fighting, Ground, , Rock",109.22,77.4,4,6,5,4,5,3,The temperature inside its body increases when it experiences strong emotions. It rolls around frantically while spewing flames.,"Due to the coal tar created inside it, the heap of coal on Carkol’s back never falls apart, even when the Pokémon rolls around at high speeds."
839,https://www.pokemon.com/static-assets/content-assets/cms2/img/pokedex/full/839.png,Coalossal,"male, female",Coal,"Rock, Fire","Flame Body, Steam Engine","Water, , Fighting, Ground, , Rock",279.4,308.03,5,8,7,5,6,2,"To intimidate its opponents, Coalossal will vigorously shake its body, scattering coal from its smoldering back.","It’s gentle usually but fearsome when angered. With a body that burns at over 2,700 degrees Fahrenheit, it crushes foes and turns them to ash."
