id,img_url,name,gender,category,type,abilities,weakness,height,weight,attack,defense,hp,special_attack,special_defense,speed,version_x,version_y
492,https://www.pokemon.com/static-assets/content-assets/cms2/img/pokedex/full/492.png,Shaymin,unknown,Gratitude,Grass,Natural Cure,"Fire, Ice, Poison, Flying, Bug",20.32,2.07,6,6,6,6,6,6,It can dissolve toxins in the air to instantly transform ruined land into a lush field of flowers.,The blooming of Gracidea flowers confers the power of flight upon it. Feelings of gratitude are the message it delivers.
493,https://www.pokemon.com/static-assets/content-assets/cms2/img/pokedex/full/493.png,Arceus,unknown,Alpha,Normal,Multitype,Fighting,320.04,317.48,8,8,8,8,8,8,"According to the legends of Sinnoh, this Pokémon emerged from an egg and shaped all there is in this world.",It is told in mythology that this Pokémon was born before the universe even existed.
494,https://www.pokemon.com/static-assets/content-assets/cms2/img/pokedex/full/494.png,Victini,unknown,Victory,"Psychic, Fire",Victory Star,"Water, Ground, Rock, Ghost, Dark",40.64,3.96,6,6,6,6,6,6,"This Pokémon brings victory. It is said that Trainers with Victini always win, regardless of the type of encounter.","When it shares the infinite energy it creates, that being’s entire body will be overflowing with power."
495,https://www.pokemon.com/static-assets/content-assets/cms2/img/pokedex/full/495.png,Snivy,"male, female",Grass Snake,Grass,Overgrow,"Fire, Ice, Poison, Flying, Bug",60.96,8.05,3,4,3,3,4,4,"The leaf on Snivy’s tail generates energy when exposed to sunlight, making Snivy swifter and adding an edge to its moves.","It prefers to avoid groups. In its day-to-day life, it dexterously controls its vines to compensate for its short arms."
496,https://www.pokemon.com/static-assets/content-assets/cms2/img/pokedex/full/496.png,Servine,"male, female",Grass Snake,Grass,Overgrow,"Fire, Ice, Poison, Flying, Bug",78.74,15.88,4,5,4,4,5,5,"It runs low to the ground, weaving through the grass, then mercilessly pummels its target by whipping them with its vines.",Servine’s one weakness is its inflated sense of pride. It takes a while for Servine to be able to cooperate with other Pokémon.
497,https://www.pokemon.com/static-assets/content-assets/cms2/img/pokedex/full/497.png,Serperior,"male, female",Regal,Grass,Overgrow,"Fire, Ice, Poison, Flying, Bug",330.2,62.51,5,6,5,5,6,7,"It generates energy from sunlight, then amplifies that energy dozens of times within its long body.",An intimidating gaze and majestic appearance have caused this Pokémon to be known as the Lord of the Forest.
498,https://www.pokemon.com/static-assets/content-assets/cms2/img/pokedex/full/498.png,Tepig,"male, female",Fire Pig,Fire,Blaze,"Water, Ground, Rock",50.8,9.81,4,3,4,3,3,3,"It’s more nimble than it looks, and it uses its speed to confound its enemies. It rapidly launches fireballs from both nostrils.","This Pokémon is a ravenous glutton. It uses its excellent sense of smell to find food, then cooks it to a crisp before eating."
499,https://www.pokemon.com/static-assets/content-assets/cms2/img/pokedex/full/499.png,Pignite,"male, female",Fire Pig,"Fire, Fighting",Blaze,"Water, Ground, Flying, Psychic",99.06,55.08,6,4,6,5,4,4,"When Pignite enters battle, its body temperature rapidly soars until Pignite itself is engulfed by a scorching fireball.","When defending its friends, Pignite will stand up to any opponent, no matter how strong. But it’s powerless when faced with an empty stomach."
500,https://www.pokemon.com/static-assets/content-assets/cms2/img/pokedex/full/500.png,Emboar,"male, female",Mega Fire Pig,"Fire, Fighting",Blaze,"Water, Ground, Flying, Psychic",160.02,148.81,8,4,7,6,4,4,"The flames blazing deep inside Emboar’s chest erupt vigorously from its chin, forming a beard of fire.","The direr the situation, the more it seems to enjoy itself. The flames around its neck intensify, too, increasing Emboar’s power and speed."
501,https://www.pokemon.com/static-assets/content-assets/cms2/img/pokedex/full/501.png,Oshawott,"male, female",Sea Otter,Water,Torrent,"Grass, Electric",50.8,5.85,4,3,4,4,3,3,"It wields the scalchop on its stomach like a knife, blocking the moves of its enemies before slashing back at them in swift retaliation.",It’s said that Oshawott learned to maintain its scalchop with riverbed stones by mimicking humans it saw using whetstones.
502,https://www.pokemon.com/static-assets/content-assets/cms2/img/pokedex/full/502.png,Dewott,"male, female",Discipline,Water,Torrent,"Grass, Electric",78.74,24.3,5,4,5,5,4,4,It’s said that people modeled swordplay after the way Dewott’s movements flow like water while it’s wielding its two scalchops.,"Dewott has a studious and stern personality. It masters the use of its scalchops through dedicated, repeated training."
503,https://www.pokemon.com/static-assets/content-assets/cms2/img/pokedex/full/503.png,Samurott,"male, female",Formidable,Water,Torrent,"Grass, Electric",149.86,93.87,6,5,6,7,5,5,"A master of a sword-drawing art called iaijutsu, Samurott settles its battles with a single swing of either large sword sheathed in its foreleg armor.",Samurott leads its group strictly. Those who do not follow its rules receive a merciless thrashing.
504,https://www.pokemon.com/static-assets/content-assets/cms2/img/pokedex/full/504.png,Patrat,"male, female",Scout,Normal,"Keen Eye, Run Away",Fighting,50.8,11.52,4,3,3,3,3,3,"Using food stored in cheek pouches, they can keep watch for days. They use their tails to communicate with others.","Extremely cautious, one of them will always be on the lookout, but it won’t notice a foe coming from behind."
505,https://www.pokemon.com/static-assets/content-assets/cms2/img/pokedex/full/505.png,Watchog,"male, female",Lookout,Normal,"Keen Eye, Illuminate",Fighting,109.22,26.77,5,5,4,4,5,5,"Using luminescent matter, it makes its eyes and body glow and stuns attacking opponents.","When they see an enemy, their tails stand high, and they spit the seeds of berries stored in their cheek pouches."
506,https://www.pokemon.com/static-assets/content-assets/cms2/img/pokedex/full/506.png,Lillipup,"male, female",Puppy,Normal,"Pickup, Vital Spirit",Fighting,40.64,4.05,4,3,3,2,3,4,This Pokémon is courageous but also cautious. It uses the soft fur covering its face to collect information about its surroundings.,"This Pokémon is far brighter than the average child, and Lillipup won’t forget the love it receives or any abuse it suffers."
507,https://www.pokemon.com/static-assets/content-assets/cms2/img/pokedex/full/507.png,Herdier,"male, female",Loyal Dog,Normal,"Intimidate, Sand Rush",Fighting,88.9,14.58,5,4,4,3,4,4,Herdier is a very smart and friendly Pokémon. So much so that there’s a theory that Herdier was the first Pokémon to partner with people.,The black fur that covers this Pokémon’s body is dense and springy. Even sharp fangs bounce right off.
508,https://www.pokemon.com/static-assets/content-assets/cms2/img/pokedex/full/508.png,Stoutland,"male, female",Big-Hearted,Normal,"Intimidate, Sand Rush",Fighting,119.38,60.52,7,6,5,3,6,5,These Pokémon seem to enjoy living with humans. Even a Stoutland caught in the wild will warm up to people in about three days.,Stoutland is immensely proud of its impressive moustache. It’s said that moustache length is what determines social standing among this species.
509,https://www.pokemon.com/static-assets/content-assets/cms2/img/pokedex/full/509.png,Purrloin,"male, female",Devious,Dark,"Limber, Unburden","Fighting, Bug, Fairy",40.64,10.04,3,3,3,3,3,4,It steals things from people just to amuse itself with their frustration. A rivalry exists between this Pokémon and Nickit.,Opponents that get drawn in by its adorable behavior come away with stinging scratches from its claws and stinging pride from its laughter.
510,https://www.pokemon.com/static-assets/content-assets/cms2/img/pokedex/full/510.png,Liepard,"male, female",Cruel,Dark,"Limber, Unburden","Fighting, Bug, Fairy",109.22,37.22,6,3,4,6,3,7,Don’t be fooled by its gorgeous fur and elegant figure. This is a moody and vicious Pokémon.,This stealthy Pokémon sneaks up behind prey without making any sound at all. It competes with Thievul for territory.
511,https://www.pokemon.com/static-assets/content-assets/cms2/img/pokedex/full/511.png,Pansage,"male, female",Grass Monkey,Grass,Gluttony,"Fire, Ice, Poison, Flying, Bug",60.96,10.39,4,3,3,4,3,4,It shares the leaf on its head with weary-looking Pokémon. These leaves are known to relieve stress.,It’s good at finding berries and gathers them from all over. It’s kind enough to share them with friends.
512,https://www.pokemon.com/static-assets/content-assets/cms2/img/pokedex/full/512.png,Simisage,"male, female",Thorn Monkey,Grass,Gluttony,"Fire, Ice, Poison, Flying, Bug",109.22,30.24,6,4,5,6,4,6,It attacks enemies with strikes of its thorn-covered tail. This Pokémon is wild tempered.,"Ill tempered, it fights by swinging its barbed tail around wildly. The leaf growing on its head is very bitter."
513,https://www.pokemon.com/static-assets/content-assets/cms2/img/pokedex/full/513.png,Pansear,"male, female",High Temp,Fire,Gluttony,"Water, Ground, Rock",60.96,10.94,4,3,3,4,3,4,"Very intelligent, it roasts berries before eating them. It likes to help people.",This Pokémon lives in caves in volcanoes. The fire within the tuft on its head can reach 600 degrees Fahrenheit.
514,https://www.pokemon.com/static-assets/content-assets/cms2/img/pokedex/full/514.png,Simisear,"male, female",Ember,Fire,Gluttony,"Water, Ground, Rock",99.06,27.77,6,4,5,6,4,6,A flame burns inside its body. It scatters embers from its head and tail to sear its opponents.,"When it gets excited, embers rise from its head and tail and it gets hot. For some reason, it loves sweets."
515,https://www.pokemon.com/static-assets/content-assets/cms2/img/pokedex/full/515.png,Panpour,"male, female",Spray,Water,Gluttony,"Grass, Electric",60.96,13.41,4,3,3,4,3,4,The water stored inside the tuft on its head is full of nutrients. It waters plants with it using its tail.,The water stored inside the tuft on its head is full of nutrients. Plants that receive its water grow large.
516,https://www.pokemon.com/static-assets/content-assets/cms2/img/pokedex/full/516.png,Simipour,"male, female",Geyser,Water,Gluttony,"Grass, Electric",99.06,28.75,6,4,5,6,4,6,"The high-pressure water expelled from its tail is so powerful, it can destroy a concrete wall.","It prefers places with clean water. When its tuft runs low, it replenishes it by siphoning up water with its tail."
517,https://www.pokemon.com/static-assets/content-assets/cms2/img/pokedex/full/517.png,Munna,"male, female",Dream Eater,Psychic,"Synchronize, Forewarn","Bug, Ghost, Dark",60.96,23.13,2,3,5,4,4,2,"Late at night, it appears beside people’s pillows. As it feeds on dreams, the patterns on its body give off a faint glow.","It eats dreams and releases mist. The mist is pink when it’s eating a good dream, and black when it’s eating a nightmare."
518,https://www.pokemon.com/static-assets/content-assets/cms2/img/pokedex/full/518.png,Musharna,"male, female",Drowsing,Psychic,"Synchronize, Forewarn","Bug, Ghost, Dark",109.22,60.03,4,5,7,7,6,2,"When dark mists emanate from its body, don’t get too near. If you do, your nightmares will become reality.","It drowses and dreams all the time. It’s best to leave it be if it’s just woken up, as it’s a terrible grump when freshly roused from sleep."
519,https://www.pokemon.com/static-assets/content-assets/cms2/img/pokedex/full/519.png,Pidove,"male, female",Tiny Pigeon,"Normal, Flying","Super Luck, Big Pecks","Electric, Ice, Rock",30.48,2.07,4,3,3,3,2,3,"Where people go, these Pokémon follow. If you’re scattering food for them, be careful—several hundred of them can gather at once.","It’s forgetful and not very bright, but many Trainers love it anyway for its friendliness and sincerity."
520,https://www.pokemon.com/static-assets/content-assets/cms2/img/pokedex/full/520.png,Tranquill,"male, female",Wild Pigeon,"Normal, Flying","Super Luck, Big Pecks","Electric, Ice, Rock",60.96,14.89,5,4,4,3,3,4,"It can fly moderately quickly. No matter how far it travels, it can always find its way back to its master and its nest.",These bright Pokémon have acute memories. Apparently delivery workers often choose them as their partners.
521,https://www.pokemon.com/static-assets/content-assets/cms2/img/pokedex/full/521.png,Unfezant,male,Proud,"Normal, Flying","Super Luck, Big Pecks","Electric, Ice, Rock",119.38,28.75,7,5,5,4,4,6,"Unfezant are exceptional fliers. The females are known for their stamina, while the males outclass them in terms of speed.",This Pokémon is intelligent and intensely proud. People will sit up and take notice if you become the Trainer of one.
522,https://www.pokemon.com/static-assets/content-assets/cms2/img/pokedex/full/522.png,Blitzle,"male, female",Electrified,Electric,"Lightning Rod, Motor Drive",Ground,78.74,29.57,4,2,3,3,2,5,"Its heartbeat generates electricity. When Blitzle is surprised and its heart rate goes up, the voltage of its electricity also rises.",This Pokémon prefers places with lots of lightning strikes. It catches lightning with its mane and stores the electricity within its body.
523,https://www.pokemon.com/static-assets/content-assets/cms2/img/pokedex/full/523.png,Zebstrika,"male, female",Thunderbolt,Electric,"Lightning Rod, Motor Drive",Ground,160.02,78.89,6,4,5,5,4,7,"This Pokémon is aggressive and has a volatile disposition. When agitated, it will illuminate its mane in yellow and fire off bolts of electricity.","Once the herd hears thunder, it chases after the storm clouds so that the Blitzle in the group can use the lightning to charge up."
524,https://www.pokemon.com/static-assets/content-assets/cms2/img/pokedex/full/524.png,Roggenrola,"male, female",Mantle,Rock,"Sturdy, Weak Armor","Water, Grass, Fighting, Ground, Steel",40.64,17.87,5,5,4,2,2,1,"It’s as hard as steel, but apparently a long soak in water will cause it to soften a bit.","When it detects a noise, it starts to move. The energy core inside it makes this Pokémon slightly warm to the touch."
525,https://www.pokemon.com/static-assets/content-assets/cms2/img/pokedex/full/525.png,Boldore,"male, female",Ore,Rock,"Sturdy, Weak Armor","Water, Grass, Fighting, Ground, Steel",88.9,101.2,7,7,5,3,3,2,"If you see its orange crystals start to glow, be wary. It’s about to fire off bursts of energy.","It relies on sound in order to monitor what’s in its vicinity. When angered, it will attack without ever changing the direction it’s facing."
526,https://www.pokemon.com/static-assets/content-assets/cms2/img/pokedex/full/526.png,Gigalith,"male, female",Compressed,Rock,"Sturdy, Sand Stream","Water, Grass, Fighting, Ground, Steel",170.18,257.94,8,8,5,4,5,2,"This hardy Pokémon can often be found on construction sites and in mines, working alongside people and Copperajah.","Although its energy blasts can blow away a dump truck, they have a limitation—they can only be fired when the sun is out."
527,https://www.pokemon.com/static-assets/content-assets/cms2/img/pokedex/full/527.png,Woobat,"male, female",Bat,"Psychic, Flying","Unaware, Klutz","Electric, Ice, Rock, Ghost, Dark",40.64,2.07,3,3,4,4,3,5,"While inside a cave, if you look up and see lots of heart-shaped marks lining the walls, it’s evidence that Woobat live there.","It emits ultrasonic waves as it flutters about, searching for its prey—bug Pokémon."
528,https://www.pokemon.com/static-assets/content-assets/cms2/img/pokedex/full/528.png,Swoobat,"male, female",Courting,"Psychic, Flying","Unaware, Klutz","Electric, Ice, Rock, Ghost, Dark",88.9,10.39,4,4,4,5,4,7,"Emitting powerful sound waves tires it out. Afterward, it won’t be able to fly for a little while.",The auspicious shape of this Pokémon’s nose apparently led some regions to consider Swoobat a symbol of good luck.
529,https://www.pokemon.com/static-assets/content-assets/cms2/img/pokedex/full/529.png,Drilbur,"male, female",Mole,Ground,"Sand Rush, Sand Force","Water, Grass, Ice",30.48,8.41,5,3,4,2,3,4,It can dig through the ground at a speed of 30 mph. It could give a car running aboveground a good race.,It makes its way swiftly through the soil by putting both claws together and rotating at high speed.
530,https://www.pokemon.com/static-assets/content-assets/cms2/img/pokedex/full/530.png,Excadrill,"male, female",Subterrene,"Ground, Steel","Sand Rush, Sand Force","Fire, Water, Fighting, Ground",71.12,40.09,8,4,7,3,4,6,"Forming a drill with its steel claws and head, it can bore through a steel plate, no matter how thick it is.","Its drill, which has evolved into steel, is strong enough to bore through iron plates. This Pokémon is a great help in tunnel construction."
531,https://www.pokemon.com/static-assets/content-assets/cms2/img/pokedex/full/531.png,Audino,"male, female",Hearing,Normal,"Healer, Regenerator",Fighting,109.22,30.73,4,6,7,4,6,3,Audino’s sense of hearing is superb. Not even a pebble rolling along over a mile away will escape Audino’s ears.,"This Pokémon has a kind heart. By touching with its feelers, Audino can gauge other creatures’ feelings and physical conditions."
532,https://www.pokemon.com/static-assets/content-assets/cms2/img/pokedex/full/532.png,Timburr,"male, female",Muscular,Fighting,"Guts, Sheer Force","Flying, Psychic, Fairy",60.96,12.42,5,4,5,2,3,3,"Always carrying squared logs, they help out with construction. As they grow, they carry bigger logs.",It fights by swinging a piece of lumber around. It is close to evolving when it can handle heavy lumber without difficulty.
533,https://www.pokemon.com/static-assets/content-assets/cms2/img/pokedex/full/533.png,Gurdurr,"male, female",Muscular,Fighting,"Guts, Sheer Force","Flying, Psychic, Fairy",119.38,39.69,7,5,5,3,3,3,They strengthen their bodies by carrying steel beams. They show off their big muscles to their friends.,This Pokémon is so muscular and strongly built that even a group of wrestlers could not make it budge an inch.
534,https://www.pokemon.com/static-assets/content-assets/cms2/img/pokedex/full/534.png,Conkeldurr,"male, female",Muscular,Fighting,"Guts, Sheer Force","Flying, Psychic, Fairy",139.7,86.31,9,6,7,4,4,3,"It is thought that Conkeldurr taught humans how to make concrete more than 2,000 years ago.","Rather than rely on their strength, they master moves that make good use of centrifugal force to swing around concrete."
535,https://www.pokemon.com/static-assets/content-assets/cms2/img/pokedex/full/535.png,Tympole,"male, female",Tadpole,Water,"Hydration, Swift Swim","Grass, Electric",50.8,4.46,3,3,3,3,3,4,Graceful ripples running across the water’s surface are a sure sign that Tympole are singing in high-pitched voices below.,It uses sound waves to communicate with others of its kind. People and other Pokémon species can’t hear its cries of warning.
536,https://www.pokemon.com/static-assets/content-assets/cms2/img/pokedex/full/536.png,Palpitoad,"male, female",Vibration,"Water, Ground","Hydration, Swift Swim","Grass,",78.74,16.88,4,4,5,4,4,5,"It weakens its prey with sound waves intense enough to cause headaches, then entangles them with its sticky tongue.","On occasion, their cries are sublimely pleasing to the ear. Palpitoad with larger lumps on their bodies can sing with a wider range of sounds."
537,https://www.pokemon.com/static-assets/content-assets/cms2/img/pokedex/full/537.png,Seismitoad,"male, female",Vibration,"Water, Ground","Swift Swim, Poison Touch","Grass,",149.86,61.51,6,5,7,5,5,5,The vibrating of the bumps all over its body causes earthquake-like tremors. Seismitoad and Croagunk are similar species.,"This Pokémon is popular among the elderly, who say the vibrations of its lumps are great for massages."
538,https://www.pokemon.com/static-assets/content-assets/cms2/img/pokedex/full/538.png,Throh,male,Judo,Fighting,"Guts, Inner Focus","Flying, Psychic, Fairy",129.54,55.08,6,5,8,2,5,3,"It performs throwing moves with first-rate skill. Over the course of many battles, Throh’s belt grows darker as it absorbs its wearer’s sweat.",They train in groups of five. Any member that can’t keep up will discard its belt and leave the group.
539,https://www.pokemon.com/static-assets/content-assets/cms2/img/pokedex/full/539.png,Sawk,male,Karate,Fighting,"Inner Focus, Sturdy","Flying, Psychic, Fairy",139.7,50.58,8,5,5,2,5,5,"If you see a Sawk training in the mountains in its single-minded pursuit of strength, it’s best to quietly pass by.",The karate chops of a Sawk that’s trained itself to the limit can cleave the ocean itself.
540,https://www.pokemon.com/static-assets/content-assets/cms2/img/pokedex/full/540.png,Sewaddle,"male, female",Sewing,"Bug, Grass","Swarm, Chlorophyll","Fire, , Ice, Poison, Flying, , Bug, Rock",30.48,2.48,4,5,3,3,4,3,Sewaddle chews on leaves to make its clothing. It’s trying to mimic the leafy garment Leavanny first dressed it in.,"The bumps on their heads are sensory organs. When Sewaddle meet, they greet each other by rubbing these bumps together."
541,https://www.pokemon.com/static-assets/content-assets/cms2/img/pokedex/full/541.png,Swadloon,"male, female",Leaf-Wrapped,"Bug, Grass","Chlorophyll, Leaf Guard","Fire, , Ice, Poison, Flying, , Bug, Rock",50.8,7.25,4,6,4,3,5,3,Swadloon lives quietly at the feet of trees. It prefers eating fallen leaves that have grown soft rather than fresh ones.,Swadloon wraps itself in leaves for protection. It uses the two leaves atop its head to detect air movements and feel out its surroundings.
542,https://www.pokemon.com/static-assets/content-assets/cms2/img/pokedex/full/542.png,Leavanny,"male, female",Nurturing,"Bug, Grass","Swarm, Chlorophyll","Fire, , Ice, Poison, Flying, , Bug, Rock",119.38,20.34,7,5,5,5,5,6,This gentle Pokémon has strong protective instincts. The leaves on its arms are sharp enough to slice a thick tree in half with one stroke.,"It fashions clothing from woven leaves. Though gentle in disposition, it will show no mercy to foes who target young Pokémon."
543,https://www.pokemon.com/static-assets/content-assets/cms2/img/pokedex/full/543.png,Venipede,"male, female",Centipede,"Bug, Poison","Swarm, Poison Point","Fire, Flying, Psychic, Rock",40.64,5.26,3,4,2,2,3,4,"Venipede and Sizzlipede are similar species, but when the two meet, a huge fight ensues.","Its fangs are highly venomous. If this Pokémon finds prey it thinks it can eat, it leaps for them without any thought of how things might turn out."
544,https://www.pokemon.com/static-assets/content-assets/cms2/img/pokedex/full/544.png,Whirlipede,"male, female",Curlipede,"Bug, Poison","Swarm, Poison Point","Fire, Flying, Psychic, Rock",119.38,58.05,4,6,3,3,5,3,This Pokémon spins itself rapidly and charges into its opponents. Its top speed is just over 60 mph.,Whirlipede protects itself with a sturdy shell and poisonous spikes while it stores up the energy it’ll need for evolution.
545,https://www.pokemon.com/static-assets/content-assets/cms2/img/pokedex/full/545.png,Scolipede,"male, female",Megapede,"Bug, Poison","Swarm, Poison Point","Fire, Flying, Psychic, Rock",248.92,198.9,6,6,4,4,5,7,Scolipede latches on to its prey with the claws on its neck before slamming them into the ground and jabbing them with its claws’ toxic spikes.,"Scolipede engage in fierce territorial battles with Centiskorch. At the end of one of these battles, the victor makes a meal of the loser."
546,https://www.pokemon.com/static-assets/content-assets/cms2/img/pokedex/full/546.png,Cottonee,"male, female",Cotton Puff,"Grass, Fairy","Prankster, Infiltrator","Fire, Ice, Poison, , Flying, Steel",30.48,0.59,2,4,3,3,3,4,"Pillows and beds stuffed with cotton exhaled by Cottonee are soft and puffy, light and airy—altogether top quality.","When attacked, it escapes by shooting cotton from its body. The cotton serves as a decoy to distract the attacker."
547,https://www.pokemon.com/static-assets/content-assets/cms2/img/pokedex/full/547.png,Whimsicott,"male, female",Windveiled,"Grass, Fairy","Prankster, Infiltrator","Fire, Ice, Poison, , Flying, Steel",71.12,6.57,4,5,4,5,5,7,"Like the wind, it can slip through any gap, no matter how small. It leaves balls of white fluff behind.","It rides on the wind and slips into people’s homes. After it has turned a room into a cotton-filled mess, it giggles to itself and takes off."
548,https://www.pokemon.com/static-assets/content-assets/cms2/img/pokedex/full/548.png,Petilil,", female",Bulb,Grass,"Chlorophyll, Own Tempo","Fire, Ice, Poison, Flying, Bug",50.8,6.57,3,3,3,5,3,2,The leaves on its head grow right back even if they fall out. These bitter leaves refresh those who eat them.,"If the leaves on its head are pruned with regularity, this Pokémon can be grown into a fine plump shape."
549,https://www.pokemon.com/static-assets/content-assets/cms2/img/pokedex/full/549.png,Lilligant,", female",Flowering,Grass,"Chlorophyll, Own Tempo","Fire, Ice, Poison, Flying, Bug",109.22,16.16,4,5,5,7,5,6,"The fragrance of the garland on its head has a relaxing effect, but taking care of it is very difficult.","No matter how much time and money is spent raising it, its flowers are the most beautiful when they bloom in the wild."
550,https://www.pokemon.com/static-assets/content-assets/cms2/img/pokedex/full/550.png,Basculin,"male, female",Hostile,Water,"Reckless, Adaptability","Grass, Electric",99.06,17.87,6,4,5,5,4,6,Its temperament is vicious and aggressive. This Pokémon is also full of vitality and can multiply rapidly before anyone notices.,"It’s so vicious that it’s called the Thug of the River. Yet Basculin is still targeted by predators, such as Dondozo and Bombirdier."
